Logo (ruta),Título,Descripción,Inscripciones,Vistas,Rating general,Rating por estrellas,Rating del contenido
https://d3njjcbhbojbot.cloudfront.net/api/utilities/v1/imageproxy/https://s3.amazonaws.com/coursera-course-photos/bc/d3b6a0e99111e6a8c51f78ab61cec6/Finance_Coursera_Course_Thumb.png,Introducción a las finanzas,"En este curso estudiaremos el objetivo principal de las finanzas, la importancia en la creación de valor y mantenerlo a través de un uso eficiente de los recursos financieros.Además, incluiremos algunas herramientas básicas que te permitirán crear un plan financiero con el que podrás establecer objetivos y metas claras, identificar qué factores pueden afectar el rumbo de tu empresa o idea de negocio y saber si estás aplicando los recursos de una manera eficiente.
Al término del curso aplicarás herramientas básicas de análisis, control y evaluación de información financiera para una adecuada gestión de negocio.",33307,59269,4.6,"[{'Estrellas': 5, 'Porcentaje': '75.63'}, {'Estrellas': 4, 'Porcentaje': '17.81'}, {'Estrellas': 3, 'Porcentaje': '3.27'}, {'Estrellas': 2, 'Porcentaje': '1.45'}, {'Estrellas': 1, 'Porcentaje': '1.81'}]",93
https://d3njjcbhbojbot.cloudfront.net/api/utilities/v1/imageproxy/https://s3.amazonaws.com/coursera-course-photos/a0/915380aa2511e7a88665d762f00452/logo_bienes_comunes.png,Introducción al estudio de los bienes comunes,"El curso te introduce al estudio de los bienes comunes (como bosques, mecanismos de irrigación, tierras de pastoreo, pesquerías, recursos culturales o la información) y su gobernanza. El eje central del curso es la propuesta de la Teoría de la Acción Colectiva y de los Recursos Comunes, considerando sus elementos teóricos centrales y sus implicaciones metodológicas. La teoría de la acción colectiva está entendida como la movilización de las acciones de los miembros de grupos y/o de la sociedad, con propósitos de cooperación. Este tipo de acción es fundamental para la gobernanza con perspectiva de largo plazo (es decir, el uso sostenido y la conservación) de los “bienes comunes”. A lo largo del seminario se buscará relacionar los contenidos teóricos con distintos problemas empíricos locales, nacionales y globales.",3793,9399,4.9,"[{'Estrellas': 5, 'Porcentaje': '86.27'}, {'Estrellas': 4, 'Porcentaje': '13.72'}]",0
https://d3njjcbhbojbot.cloudfront.net/api/utilities/v1/imageproxy/https://s3.amazonaws.com/coursera-course-photos/44/7b69b8e6134292857f643f1490b1c5/29.jpg,Introducción al mercado,"El estudio de mercado nos ayuda a identificar y definir oportunidades y problemas de mercado, para generar y evaluar estrategias de promoción y venta de los productos y/o servicios de tu empresa o idea de negocio, y a su vez mejorar la relación que existe entre la empresa y sus clientes, consumidores, proveedores, etc.En este curso conoceremos las herramientas que se utilizan en la mercadotecnia para la venta y promoción de un producto y/o servicio, así como algunos métodos para la determinación de su precio y las características con las que contará dicho producto.",19802,20959,4.7,"[{'Estrellas': 5, 'Porcentaje': '80.83'}, {'Estrellas': 4, 'Porcentaje': '10.17'}, {'Estrellas': 3, 'Porcentaje': '4.79'}, {'Estrellas': 2, 'Porcentaje': '2.39'}, {'Estrellas': 1, 'Porcentaje': '1.79'}]",98
https://d3njjcbhbojbot.cloudfront.net/api/utilities/v1/imageproxy/https://s3.amazonaws.com/coursera-course-photos/21/e470078e6742b9a5770d8925484a8d/EstrategiasNegociacion_1.jpg,Introducción al mundo de las negociaciones,"En este primer curso, los participantes conocerán el proceso de una negociación, la naturaleza de uno mismo (capacidades y potencialidades) y la de los oponentes, para establecer negociaciones efectivas, en donde se establece una dinámica de propuestas y transacciones racionales y emocionales, en el marco de la globalización, para generar un ambiente de negociación y cooperación creativa, para diseñar estrategias para lograr resultados de negociación, diseñar argumentos para negociar, saber escuchar y comunicarse y convenir en un intercambio de los recursos y bienes en juego, favorable a los intereses de ambas partes. .",33479,66600,4.8,"[{'Estrellas': 5, 'Porcentaje': '86.24'}, {'Estrellas': 4, 'Porcentaje': '11.20'}, {'Estrellas': 3, 'Porcentaje': '1.76'}, {'Estrellas': 2, 'Porcentaje': '0.32'}, {'Estrellas': 1, 'Porcentaje': '0.48'}]",99
https://d3njjcbhbojbot.cloudfront.net/api/utilities/v1/imageproxy/https://s3.amazonaws.com/coursera-course-photos/15/23b33c36064572bb3579c53f743911/LaSolucionCEtico_FINAL.jpg,La solución del conflicto ético,"En este curso, ofrecido por la UNAM, los participantes lograrán identificar y tomar decisiones sobre casos clínicos con conflictos éticos en el área de la salud por medio de la aplicación del razonamiento ético desde una perspectiva universal y considerando los aspectos médicos y éticos, el marco jurídico y la decisión ética. La ética en lo general es un elemento esencial para el avance del ser humano porque resulta de la capacidad de cuestionar, reflexionar y razonar sobre todo lo que es y todo lo que cambia en la vida. Existe evidencia de que la percepción y los juicios, que sobre la moral hace un individuo, definen su comportamiento. Estas capacidades que se desarrollan en forma paulatina, permiten atender y resolver los conflictos éticos.

Para facilitar tus logros tendrás disponibles videos y evaluaciones.",24014,58853,4.7,"[{'Estrellas': 5, 'Porcentaje': '77.70'}, {'Estrellas': 4, 'Porcentaje': '15.08'}, {'Estrellas': 3, 'Porcentaje': '3.93'}, {'Estrellas': 2, 'Porcentaje': '1.96'}, {'Estrellas': 1, 'Porcentaje': '1.31'}]",97
https://d3njjcbhbojbot.cloudfront.net/api/utilities/v1/imageproxy/https://s3.amazonaws.com/coursera-course-photos/d9/08c8de308f49719140a2b53998732c/VerdeySusverdades_FINAL.jpg,La verde y sus verdades,"En este curso los alumnos tendrán la posibilidad de acceder a información de carácter científico, sociológico, médico y legal que les permita tener un panorama de las distintas aristas que contiene el tema de la regulación de la marihuana en México. Podrán conocer lo que ha ocurrido en el mundo, particularmente en Estados Unidos en donde existe un movimiento social, cultural, político, médico y económico sobre este fenómeno.La solución de Estados Unidos y Canadá será aprovechada por los legisladores y los funcionarios mexicanos de la Secretaría de Salud encargados de diseñar el modelo para México, por lo que el público interesado encontrará la información necesaria para comprender e interpretar este hecho. Los alumnos podrán conocer cómo se han develado y aclarado los mitos alrededor del uso de la marihuana, así como los beneficios que tiene su uso medicinal y terapéutico.",3901,8456,4.7,"[{'Estrellas': 5, 'Porcentaje': '75'}, {'Estrellas': 4, 'Porcentaje': '21.87'}, {'Estrellas': 3, 'Porcentaje': '1.56'}, {'Estrellas': 2, 'Porcentaje': '1.56'}]",0
https://d3njjcbhbojbot.cloudfront.net/api/utilities/v1/imageproxy/https://s3.amazonaws.com/coursera-course-photos/1f/4f132eaa054faa8c5b945d9cceff08/LasEstaciones2_FINAL.jpg,Las estaciones del año y el clima,"¿Sabes por qué hay animales que migran cada año? ¿Cómo saben los campesinos cuándo sembrar y cuándo cosechar?¿Sabes qué gobierna el ciclo anual de frío y calor y de lluvias y secas?

Las estaciones del año son el fenómeno climático más perceptible por el ser humano y se manifiestan de diferente forma en distintas regiones; por ejemplo cuando es invierno en la mitad del mundo,  es verano en la otra mitad.  Entender el mecanismo de las estaciones es el primer paso para entender el clima, que afecta a casi todas las actividades humanas.

En este curso estudiaremos los procesos que provocan las estaciones del año, las repercusiones que tienen éstas para las actividades humanas y su relación con los  fundamentos del sistema climático terrestre. A través de simulaciones visuales haremos comprensibles conceptos y procesos físicos y te propondremos experimentos. Si estas considerando estudiar ciencias de la Tierra o si quieres comprender mejor cómo funciona el clima, este curso es para ti. 

¡Acompáñanos! Y conoce más sobre nuestro hogar el planeta Tierra.",19158,11613,4.8,"[{'Estrellas': 5, 'Porcentaje': '84.10'}, {'Estrellas': 4, 'Porcentaje': '12.71'}, {'Estrellas': 3, 'Porcentaje': '2.31'}, {'Estrellas': 2, 'Porcentaje': '0.86'}]",98
https://d3njjcbhbojbot.cloudfront.net/api/utilities/v1/imageproxy/https://s3.amazonaws.com/coursera-course-photos/d8/dc088bf3814a6981d8de47e0b230ed/EstrategiasNegociacion_4.jpg,Las estrategias y habilidades para las negociaciones,"En este cuarto y último curso estudiaremos y analizaremos las estrategias, herramientas y criterios para dar efectividad al proceso de las negociaciones. También se propondrá el empleo del concepto de áreas de efectividad y orientación a resultados, que facilitará la definición de objetivos específicos y cuantificables para planear estratégicamente nuestra negociación con el empleo del establecimiento de los máximos aceptables y mínimos que cada propuesta de solución presenta para un manejo efectivo de las concesiones, intercambios y toma de decisiones, con el fin de lograr acuerdos compartidos. Finalmente se establecerá una visión futura de creación de valor, sobre el acuerdo para continuar en el tiempo obteniendo beneficios compartidos.",19666,31320,4.7,"[{'Estrellas': 5, 'Porcentaje': '80.20'}, {'Estrellas': 4, 'Porcentaje': '15.62'}, {'Estrellas': 3, 'Porcentaje': '3.12'}, {'Estrellas': 2, 'Porcentaje': '1.04'}]",99
https://d3njjcbhbojbot.cloudfront.net/api/utilities/v1/imageproxy/https://s3.amazonaws.com/coursera-course-photos/8c/e4c8d0ee5a11e68dae39c5756623e8/inter_gob_loc.png,Los gobiernos locales como actores internacionales,"Este curso ofrece un panorama general de la irrupción de los gobiernos locales en la escena internacional. Revisaremos las nuevas tendencias y dinámicas en las relaciones internacionales de los gobiernos locales, mediante fundamentos teóricos con base en la práctica.El objetivo es introducir a profesionales, investigadores, académicos y público en general, en las nuevas tendencias y dinámicas en las relaciones internacionales de los gobiernos locales. 

Con este curso podrás:

•Desarrollar una visión general del fenómeno que constituye la entrada de los gobiernos locales en la esfera internacional.

•Reconocer los principales objetivos que persiguen los gobiernos locales al buscar la internacionalización.

•Reconocer la importancia del trabajo en redes como una de las modalidades de acción más frecuentes entre las ciudades.

•Analizar las relaciones y los eventuales conflictos que se están desarrollando entre los GL y los gobiernos nacionales.

•Valorar si su propia ciudad puede contar con apoyo del gobierno central y/o de los actores locales en caso de querer plantear, planificar y desarrollar una acción internacional.

•Identificar los beneficios que la ciudadanía puede obtener de la acción internacional de su municipio

Este curso es una colaboración  del Programa Universitario de estudios sobre la Ciudad de la Universidad Nacional Autónoma de México (PUEC-UNAM,  el Gobierno de la Ciudad de México y la Alianza Euro Latinoamericana de Cooperación entre Ciudades (AL-LAs).",19560,23716,4.8,"[{'Estrellas': 5, 'Porcentaje': '79.68'}, {'Estrellas': 4, 'Porcentaje': '16.54'}, {'Estrellas': 3, 'Porcentaje': '3.48'}, {'Estrellas': 2, 'Porcentaje': '0.29'}]",96
https://d3njjcbhbojbot.cloudfront.net/api/utilities/v1/imageproxy/https://s3.amazonaws.com/coursera-course-photos/e6/20b425a48f46a4bba90557d8864d1d/EstrategiasNegociacion_3.jpg,Los obstáculos y la conducción en las negociaciones,"En este curso se analizará para su aplicación la ubicación y señalamiento de los obstáculos que se presentan durante el proceso de negociación. Es interesante observar que en este análisis no sólo se plantean los obstáculos, sino se hacen observaciones sobre las condiciones que se presentan para identificar el obstáculo con las habilidades y estrategias que se ofrecen para su manejo efectivo. La presentación de los nueve obstáculos que propone nuestro modelo de negociación se hace en forma de aparición secuencial, lo que permite la previsión necesaria para evitarlos. Finalmente incorporaremos un elemento nuevo al proceso de negociación, que es el factor del tiempo y del ritmo, para que cada una de las fases cumpla con un requerimiento de exactitud en su cumplimiento.",8066,15719,4.8,"[{'Estrellas': 5, 'Porcentaje': '80.88'}, {'Estrellas': 4, 'Porcentaje': '17.64'}, {'Estrellas': 3, 'Porcentaje': '0.73'}, {'Estrellas': 2, 'Porcentaje': '0.73'}]",99
https://d3njjcbhbojbot.cloudfront.net/api/utilities/v1/imageproxy/https://s3.amazonaws.com/coursera-course-photos/50/7dc6f1122c4a929bf050e37e008c59/Manejo-moderno-de-la-caries-dental_FINAL.jpg,Manejo moderno de la caries dental,"Se trata de un curso básico sobre el tratamiento de la caries dental para controlar su progresión. Existen diversas posturas sobre el tratamiento de esta enfermedad. En este curso, se revisa una aproximación al tratamiento no invasivo de este problema. La caries dental es examinada no sólo como la destrucción parcial o total del diente, sino como una enfermedad que presenta diferentes fases. Asimismo, se analizan principios y elementos para controlar la caries dental, antes de que se presenten cambios observables en los dientes.Al término del curso:

Conocerás las bases para determinar el tratamiento que conduzca al control de la enfermedad caries dental.",11091,18668,4.8,"[{'Estrellas': 5, 'Porcentaje': '85.25'}, {'Estrellas': 4, 'Porcentaje': '11.05'}, {'Estrellas': 3, 'Porcentaje': '1.38'}, {'Estrellas': 2, 'Porcentaje': '0.92'}, {'Estrellas': 1, 'Porcentaje': '1.38'}]",95
https://d3njjcbhbojbot.cloudfront.net/api/utilities/v1/imageproxy/https://s3.amazonaws.com/coursera-course-photos/6c/a212dc3549455fa03ac5d3473fa59e/Finanzas-2.jpg,Matemáticas financieras,"En el curso matemáticas financieras se explica la relación que tiene el dinero y su valor a través del tiempo. Se abordan los temas de interés simple, interés compuesto, anualidades, perpetuidades, amortizaciones, valor presente y valor futuro, todos ellos elementos básicos que el administrador financiero deberá aplicar en los análisis de opciones de inversión o financiamiento.",18853,46351,4.8,"[{'Estrellas': 5, 'Porcentaje': '81.97'}, {'Estrellas': 4, 'Porcentaje': '15.31'}, {'Estrellas': 3, 'Porcentaje': '1.62'}, {'Estrellas': 2, 'Porcentaje': '0.81'}, {'Estrellas': 1, 'Porcentaje': '0.27'}]",97
https://d3njjcbhbojbot.cloudfront.net/api/utilities/v1/imageproxy/https://s3.amazonaws.com/coursera-course-photos/5e/054c7165dc474e9a074d3c7b99072f/Database-System_3.jpg,NoSQL systems,"Welcome to the specialization course of NoSQL Systems. This course will be completed on six weeks, it will be supported with videos and exercises that will allow you to identify the differences between the relational and NoSQL databases. 
As part of these alternative technologies the student will learn the main characteristics and how to implement the typical NoSQL databases, such as Key-value, columnar, document and graph. 
Let's start!

After completing this course, a learner will be able to
●	Identify what type of NoSQL database to implement based on business requirements (key-value, document, full text, graph, etc.)
●	Apply NoSQL data modeling from application specific queries
●	Use Atomic Aggregates and denormalization as data modelling techniques to optimize query processing

Software to download:
MongoDB
Neo4j
SAPIQ
Cassandra

In case you have a Mac / IOS operating system you will need to use a virtual Machine (VirtualBox, Vmware).",7290,17549,4.2,"[{'Estrellas': 5, 'Porcentaje': '60.55'}, {'Estrellas': 4, 'Porcentaje': '17.43'}, {'Estrellas': 3, 'Porcentaje': '8.25'}, {'Estrellas': 2, 'Porcentaje': '5.50'}, {'Estrellas': 1, 'Porcentaje': '8.25'}]",0
https://d3njjcbhbojbot.cloudfront.net/api/utilities/v1/imageproxy/https://s3.amazonaws.com/coursera-course-photos/6a/2ad187db614134a4d661229bb5e6a1/NuevosModelosNegocio_FINAL.jpg,Nuevos modelos de negocios en el siglo XXI,"Este curso está dirigido a toda persona que quiera adquirir las bases fundamentales para comprender los alcances sociales, económicos y medioambientales de la responsabilidad social.El conocimiento adquirido te ayudará a generar ideas que se traducirán en impactos positivos para tu negocio u organización con responsabilidad social. Esto con el objeto de tener organizaciones y sociedades comprometidas con la nueva forma de hacer negocios, mismos que medirán su éxito social y económico con base en el progreso social, lo que garantiza su viabilidad a largo plazo.",9240,13969,4.7,"[{'Estrellas': 5, 'Porcentaje': '78.37'}, {'Estrellas': 4, 'Porcentaje': '18.01'}, {'Estrellas': 3, 'Porcentaje': '0.90'}, {'Estrellas': 2, 'Porcentaje': '0.90'}, {'Estrellas': 1, 'Porcentaje': '1.80'}]",0
https://d3njjcbhbojbot.cloudfront.net/api/utilities/v1/imageproxy/https://s3.amazonaws.com/coursera-course-photos/74/b34c91ff7e42c88ae807d84848f51c/NutricionObesidad_FINAL.jpg,Nutrición y obesidad: control de sobrepeso,"En este curso, ofrecido por la UNAM, reconocerás una herramienta para evitar, manejar y controlar el sobrepeso y la obesidad, al destacar la importancia del autocuidado y el apoyo familiar en el manejo de este padecimiento. Te mostrará el verdadero valor de los alimentos como compañeros de tu vida, te alejará de los kilos de más y te forjará hábitos saludables que marcarán una senda de salud perdurable.",151719,286244,4.8,"[{'Estrellas': 5, 'Porcentaje': '85.53'}, {'Estrellas': 4, 'Porcentaje': '10.82'}, {'Estrellas': 3, 'Porcentaje': '2.40'}, {'Estrellas': 2, 'Porcentaje': '0.71'}, {'Estrellas': 1, 'Porcentaje': '0.51'}]",97
https://d3njjcbhbojbot.cloudfront.net/api/utilities/v1/imageproxy/https://s3.amazonaws.com/coursera-course-photos/e5/0e9a36753b455a8ddc6fe1ec354596/Habilidades-gerenciales_3.jpg,Orden y manejo del tiempo,"En este curso realizarás varios ejercicios para diagnosticar y desarrollar destrezas para el manejo efectivo de tu tiempo al clasificar prioridades y necesidades de la empresa.Por otra parte, desarrollarás habilidades para fortalecer una actitud de orden y respeto por las normas y procedimientos de trabajo valorando la importancia de contar con un clima organizado en donde todo el equipo se siente cómodo y sabe dónde encontrar los materiales relacionados con el trabajo del área.",23309,69334,4.8,"[{'Estrellas': 5, 'Porcentaje': '84.70'}, {'Estrellas': 4, 'Porcentaje': '12.99'}, {'Estrellas': 3, 'Porcentaje': '1.62'}, {'Estrellas': 2, 'Porcentaje': '0.54'}, {'Estrellas': 1, 'Porcentaje': '0.13'}]",97
https://d3njjcbhbojbot.cloudfront.net/api/utilities/v1/imageproxy/https://s3.amazonaws.com/coursera-course-photos/99/5b30451d4d4624addee6e55f53a6c4/PensamientoCientifico_FINAL.jpg,Pensamiento científico,"¿El pensamiento científico es sólo para científicos? Su utilidad va mucho más allá, ayudando a las personas a tomar mejores decisiones todos los días. El objetivo de este curso es fomentar en pensamiento científico en los alumnos para ayudarles a tomar mejores decisiones profesionales, personales y sociales. Para lograr este objetivo, el curso destila conceptos de ciencias y filosofía a un nivel accesible al público general, ilustrándolos con ejemplos actuales de diversas áreas.",104423,100379,4.7,"[{'Estrellas': 5, 'Porcentaje': '81.73'}, {'Estrellas': 4, 'Porcentaje': '14.13'}, {'Estrellas': 3, 'Porcentaje': '2.80'}, {'Estrellas': 2, 'Porcentaje': '0.50'}, {'Estrellas': 1, 'Porcentaje': '0.82'}]",97
https://d3njjcbhbojbot.cloudfront.net/api/utilities/v1/imageproxy/https://s3.amazonaws.com/coursera-course-photos/3e/c7d58d476444039418cbd2cf310487/PensamientoSistemico_FINAL.jpg,Pensamiento sistémico,Este curso general tiene el propósito de promover el uso del pensamiento sistémico para nuestro beneficio y de quienes nos rodean.,76646,50613,4.7,"[{'Estrellas': 5, 'Porcentaje': '78.50'}, {'Estrellas': 4, 'Porcentaje': '15.70'}, {'Estrellas': 3, 'Porcentaje': '3.80'}, {'Estrellas': 2, 'Porcentaje': '1.10'}, {'Estrellas': 1, 'Porcentaje': '0.90'}]",99
https://d3njjcbhbojbot.cloudfront.net/api/utilities/v1/imageproxy/https://s3.amazonaws.com/coursera-course-photos/bb/2de341ebde4098b9e816ee9102d648/PeriodismoDigitalFakeN_FINAL.jpg,Periodismo digital y combate a las fake news,"Este curso es resultado de la participación de destacados académicos, periodistas y servidores públicos especializados en temas de periodismo y combate a las noticias falsas y tiene como finalidad proporcionar las herramientas básicas para ejercer el periodismo digital con compromiso y responsabilidad.",15480,40548,4.9,"[{'Estrellas': 5, 'Porcentaje': '90.76'}, {'Estrellas': 4, 'Porcentaje': '7.17'}, {'Estrellas': 3, 'Porcentaje': '1.28'}, {'Estrellas': 2, 'Porcentaje': '0.76'}]",96
https://d3njjcbhbojbot.cloudfront.net/api/utilities/v1/imageproxy/https://s3.amazonaws.com/coursera-course-photos/ec/97d5e67c0642328b3e0b354d6eccb2/TecMusical_6.jpg,Perspectivas de música colaborativa,"Este curso está dedicado a revisar las tendencias estéticas que se derivan del encuentro entre la experimentación musical y los planteamientos filosóficos del software libre y el movimiento de código abierto. Más específicamente, se analizarán algunas perspectivas de música colaborativa que parten de la idea de que las creaciones humanas deberían compartirse libremente. Desde la música remix hasta el live coding, son varias las propuestas artísticas que se revisarán a lo largo de los cuatro módulos del curso, y a partir de las discusiones y los casos que se analicen en el mismo, los estudiantes desarrollarán una serie de proyectos sonoros que pondrán en circulación utilizando licencias Creative Commons.",0,2004,5.0,"[{'Estrellas': 5, 'Porcentaje': '100'}]",0
https://d3njjcbhbojbot.cloudfront.net/api/utilities/v1/imageproxy/https://s3.amazonaws.com/coursera-course-photos/bc/24ab25cdc644f88cfcb5f11f75ec29/Android_1.jpg,Programando con Java para aplicaciones Android,"¡Aprende lo mejor de Java para el desarrollo en Android! Descubre lo necesario para construir tus aplicaciones móviles de una forma sencilla, objetiva y práctica.A lo largo del curso, verás diversos ejemplos para crear tu primer Hola Mundo y practicarás la programación orientada a objetos.",55381,81116,4.7,"[{'Estrellas': 5, 'Porcentaje': '77.82'}, {'Estrellas': 4, 'Porcentaje': '16.32'}, {'Estrellas': 3, 'Porcentaje': '3.82'}, {'Estrellas': 2, 'Porcentaje': '0.59'}, {'Estrellas': 1, 'Porcentaje': '1.42'}]",98
https://d3njjcbhbojbot.cloudfront.net/api/utilities/v1/imageproxy/https://s3.amazonaws.com/coursera-course-photos/ef/d82ead5b6945a8be423c0f94af7fad/Finanzas-6.jpg,Toma de decisiones financieras,"Este es el último curso del programa especializado de finanzas corporativas, ofrecido por la UNAM. En este, el administrador financiero será capaz de integrar todos los elementos aprendidos en los cinco cursos anteriores, en un caso práctico que le permita tomar decisiones de inversión y financiamiento en una situación simulada.",5743,25355,4.7,"[{'Estrellas': 5, 'Porcentaje': '73.45'}, {'Estrellas': 4, 'Porcentaje': '20.98'}, {'Estrellas': 3, 'Porcentaje': '4.32'}, {'Estrellas': 2, 'Porcentaje': '0.61'}, {'Estrellas': 1, 'Porcentaje': '0.61'}]",0
https://d3njjcbhbojbot.cloudfront.net/api/utilities/v1/imageproxy/https://s3.amazonaws.com/coursera-course-photos/4a/ea7a4345394f5e8b05e2811153dae1/EstrategiasNegociacion_5.jpg,Proyecto final sobre negociación para un mejor clima laboral,"Aquí se planteará el caso de una organización en la que están sucediendo varios acontecimientos preocupantes, que debes conciliar, negociar y resolver. Entre éstos, sobresale la existencia de conflictos latentes, inherentes a un clima laboral deteriorado por una administración centralizada de forma excesiva, en donde no se delega y se impide la participación de la gente. Prevalece la falta de cooperación entre las áreas y sus colaboradores entre sí, aunado a una falta de liderazgo, trabajo en equipo y comunicaciones defectuosas, y agregando la existencia de una situación tensa, por la presencia de una élite de profesionistas y especialistas en los altos niveles de la organización, que influyen en toda la empresa, imponiendo los intereses y la cultura de su especialidad en beneficio de su propio trabajo y de las áreas afines al mismo. Esta élite crea un clima laboral que los demás consideran déspota y hostil.Dichos aspectos hacen imposible el futuro desarrollo de la empresa y emplear el talento de la gente.

¿Qué hacer para aclarar esta situación?, ¿podrán conciliarse los intereses mediante acuerdos de cooperación?, ¿qué elementos subyacentes deberán ser considerados?, ¿quiénes pueden representar a las partes?, y lo más importante, ¿podremos encontrar una fórmula que perdure? En resumen, se requiere negociar el cambio.",3251,29801,4.8,"[{'Estrellas': 5, 'Porcentaje': '84.44'}, {'Estrellas': 4, 'Porcentaje': '11.11'}, {'Estrellas': 3, 'Porcentaje': '2.22'}, {'Estrellas': 2, 'Porcentaje': '2.22'}]",0
