Logo (ruta),Título,Descripción,Inscripciones,Vistas,Rating general,Rating por estrellas,Rating del contenido
https://d3njjcbhbojbot.cloudfront.net/api/utilities/v1/imageproxy/https://s3.amazonaws.com/coursera-course-photos/14/d1ddfe6f014e83b4df44496132c019/AutoConstruirViv2_FINAL.jpg,Cómo autoconstruir tu vivienda. Segunda etapa,"Si te has preguntado cómo es el proceso de construcción de losas, así como el diseño e instalación tanto eléctrica, hidráulica y sanitaria; no te puedes perder el curso ""Cómo autoconstruir tu vivienda. Segunda etapa"", que en su primera versión tuvo más de 60,000 estudiantes inscritos.En esta segunda etapa, te brindaremos información importante acerca de la construcción y mantenimiento de una vivienda; donde aprenderás cómo hacer el armado de una cimbra, la función de las cadenas de remate, el proceso de construcción de las escaleras, y los tipos de losas; así como los materiales y procesos principales para el diseño de una instalación eléctrica, hidráulica y sanitaria. Todo ello de la mano de especialistas en el tema, y con ayuda de recursos que te permitan conocer el funcionamiento de los componentes de tu vivienda para mejorarla, construirla o incluso autoemplearte.
¡Inscríbete, te esperamos!",12964,31046,4.8,"[{'Estrellas': 5, 'Porcentaje': '86.50'}, {'Estrellas': 4, 'Porcentaje': '11.65'}, {'Estrellas': 3, 'Porcentaje': '1.22'}, {'Estrellas': 2, 'Porcentaje': '0.61'}]",97
https://d3njjcbhbojbot.cloudfront.net/api/utilities/v1/imageproxy/https://s3.amazonaws.com/coursera-course-photos/49/d67ecb9f074c49abab761b21eb5dc1/como_hacer_una_tesis_FINAL.jpg,Cómo hacer una tesis,"Con este curso, ofrecido por la UNAM, el participante en proceso de titulación o que están finalizando estudios universitarios, será capaz de elaborar una tesis en seis meses; por medio de las herramientas adquiridas en cada módulo, a fin de que las conjuguen con los conocimientos, habilidades y aptitudes con que cuentan e impulsando sus capacidades de investigación.",193811,90217,4.8,"[{'Estrellas': 5, 'Porcentaje': '83.73'}, {'Estrellas': 4, 'Porcentaje': '13.34'}, {'Estrellas': 3, 'Porcentaje': '1.94'}, {'Estrellas': 2, 'Porcentaje': '0.48'}, {'Estrellas': 1, 'Porcentaje': '0.48'}]",98
https://d3njjcbhbojbot.cloudfront.net/api/utilities/v1/imageproxy/https://s3.amazonaws.com/coursera-course-photos/ee/0ed548358b4b3785f178c367d9400e/IA_6.jpg,Comportamiento adaptativo,"Los seres vivos han evolucionado en entornos cambiantes, por lo que han desarrollado mecanismos que les permiten exhibir comportamiento adaptativo. Usando el método sintético, podemos construir sistemas artificiales adaptativos que implementen dichos mecanismos, con lo cual también podemos incrementar nuestra comprensión de los sistemas naturales.En este curso veremos diversos conceptos que se han aplicado en la inteligencia artificial con orígenes en la biología y en la cibernética. Construyendo sobre ejemplos de sistemas vivos, revisaremos diversos algoritmos que permiten a los sistemas adaptarse y de esta manera enfrentar a la complejidad y cambios de su entorno. También cubriremos temas relacionados con la robustez, la cual complementa a la adaptación. Finalmente, veremos algunas aplicaciones de este tipo de inteligencia artificial. En el proyecto final, se desarrollará un sistema artificial que exhiba comportamiento adaptativo.",2153,3613,4.6,"[{'Estrellas': 5, 'Porcentaje': '60'}, {'Estrellas': 4, 'Porcentaje': '40'}]",0
https://d3njjcbhbojbot.cloudfront.net/api/utilities/v1/imageproxy/https://s3.amazonaws.com/coursera-course-photos/8f/5e558c737e498e9a3c0c7eced99c4d/TechMusical_04_FINAL.jpg,Composición algorítmica en Supercollider,"En este curso se ofrece una introducción a la composición musical a partir de líneas de código, particularmente en el ambiente de programación SuperCollider.A partir de una revisión de algunas de las principales herramientas de SuperCollider, el estudiante aprenderá a construir instrumentos digitales como sintetizadores y procesadores de sonido, así como secuenciadores algorítmicos, todo esto con el fin de generar sus propias composiciones.",0,3415,4.6,"[{'Estrellas': 5, 'Porcentaje': '78.94'}, {'Estrellas': 4, 'Porcentaje': '10.52'}, {'Estrellas': 3, 'Porcentaje': '5.26'}, {'Estrellas': 2, 'Porcentaje': '5.26'}]",0
https://d3njjcbhbojbot.cloudfront.net/api/utilities/v1/imageproxy/https://s3.amazonaws.com/coursera-course-photos/21/48c4d848d24fb2875c4789a2664f44/IA_5.jpg,Cómputo evolutivo,"La computación evolutiva (evolutionary computation, EC), aplica la teoría de la evolución natural y la genética en la adaptación evolutiva de estructuras computacionales, proporcionando un medio alternativo para atacar problemas complejos en diversas áreas, como la ingeniería, economía, química, medicina y, porque no, las artes. Una población de posibles soluciones de un problema dado es análoga a una población de organismos vivos que evolucionan cada generación, al recombinar los mejores individuos de la población y transmitir sus características de dichos individuos padres, a sus descendientes. En este campo, diferentes esquemas de métodos evolutivos se han desarrollado, los cuales difieren en el tipo de estructuras que conforman la población.Algoritmos evolutivos (AE), como también se le conoce al cómputo evolutivo (EC), se definen como métodos de optimización y búsqueda, los cuales están inspirados y tratan de imitar de manera parcial los procesos de la evolución natural, y mantienen una población de estructuras que evolucionan de acuerdo a reglas de selección y otros operadores genéticos, como cruzamiento y mutación (Bäck, 1996).
Los algoritmos evolutivos no son los únicos métodos de optimización propuestos a partir de sistemas biológicos. Se tiene una variedad de algoritmos de optimización, que tratan de imitar el comportamiento de sistemas naturales, como las colonias de hormigas, algoritmos culturales y optimización por cúmulos de partículas, entre otros. De aquí surge lo que se conoce como algoritmos bioinspirados, ya que toman sus bases a partir de la estructura de procesos y sistemas biológicos: la evolución, la selección natural, comportamiento social de animales, como las hormigas, abejas, peces.

BÄCK, T. (1996) Evolutionary Algorithms in Theory and Practice. Oxford University Press. DARWIN, C. (1859) On the Origin of Species by Means of Natural Selection, or the Preservation of Favoured Races in the Struggle for Life, John Murray.",2265,6040,3.8,"[{'Estrellas': 5, 'Porcentaje': '40'}, {'Estrellas': 4, 'Porcentaje': '40'}, {'Estrellas': 3, 'Porcentaje': '20'}]",0
https://d3njjcbhbojbot.cloudfront.net/api/utilities/v1/imageproxy/https://s3.amazonaws.com/coursera-course-photos/9c/1028d1609e4cb0964f954380ff04cd/ContabilidadparaNoContador_FINAL.jpg,Contabilidad para no contadores ,"En este curso, ofrecido por la UNAM, vas a entrar al  fascinante mundo de la contabilidad. Esta técnica te permitirá tomar decisiones en tu vida empresarial, corporativa, personal, profesional y de emprendedor. Entrarás al mundo de la Contabilidad para no Contadores. Vas a lograr definir qué es la contabilidad, en qué consiste y cuáles son sus principios fundamentales. También descubrirás su utilidad en tu vida cotidiana y al profesional al que debes recurrir y confiar tu vida contable.  Además, podrás saber qué nos dice la información financiera, qué y cómo debemos leerla y qué decisiones tomar basados en ella.

Prepárate para conocer los principales Estados financieros, sus elementos y su utilidad en tu vida contable.

¡Bienvenid@!",305455,376092,4.7,"[{'Estrellas': 5, 'Porcentaje': '79.24'}, {'Estrellas': 4, 'Porcentaje': '17.42'}, {'Estrellas': 3, 'Porcentaje': '2.69'}, {'Estrellas': 2, 'Porcentaje': '0.30'}, {'Estrellas': 1, 'Porcentaje': '0.33'}]",98
https://d3njjcbhbojbot.cloudfront.net/api/utilities/v1/imageproxy/https://s3.amazonaws.com/coursera-course-photos/96/60a3ab1132424984aa775dfdf5973a/ControlAutomatico2_FINAL.jpg,Control automático: La tecnología invisible ,"A lo largo de la historia, el ser humano se ha empeñado en construir dispositivos que le hagan más cómodo su día a día. Además, siempre ha estado interesado en que éstos lleven a cabo la tarea por sí mismos, sin necesidad de una supervisión continua. En nuestros días, muchos dispositivos llevan a cabo tareas como por arte de magia; pareciera que piensan o que adivinan nuestros deseos, que nunca se pueden equivocar o que su precisión y velocidad no puede ser superada. Los sistemas de control son una parte crucial de este funcionamiento. Con este curso, los participantes conocerán la aplicación de los sistemas de control y algunos ejemplos de ellos. Además, revisarán a grandes rasgos sus características básicas y sus diferentes representaciones, con especial énfasis en el modelado matemático.

Al término del curso:
Identificarás la utilidad y las características principales de los sistemas de control.
Distinguirás entre un sistema de control en lazo abierto y un sistema de control en lazo cerrado.",13997,13080,4.7,"[{'Estrellas': 5, 'Porcentaje': '77.09'}, {'Estrellas': 4, 'Porcentaje': '16.41'}, {'Estrellas': 3, 'Porcentaje': '3.43'}, {'Estrellas': 2, 'Porcentaje': '1.14'}, {'Estrellas': 1, 'Porcentaje': '1.90'}]",98
https://d3njjcbhbojbot.cloudfront.net/api/utilities/v1/imageproxy/https://s3.amazonaws.com/coursera-course-photos/6f/b755d4bfc74d33adbef29dfa0a7b00/IA_7.jpg,Creatividad computacional,"¿Qué es la creatividad? ¿Pueden ser creativas las computadoras? ¿Cómo, cuándo y con qué objetivo surgió esta nueva área de investigación? ¿Hasta dónde hemos llegado en la creación de sistemas “creativos” y qué teorías, metodologías y técnicas podemos usar para programar y evaluar este tipo de sistemas en generación de narrativas, música, descubrimiento científico, artes visuales, etcétera?Analizaremos éstas y otras preguntas, y discutiremos sobre sus implicaciones a lo largo del curso. Asimismo, conforme avances en las lecciones, irás construyendo poco a poco tu propio agente artificial creativo.

Es indispensable que cuentes con conocimientos básicos en programación (Python) y algoritmos genéticos.",2070,3281,0.0,[],0
https://d3njjcbhbojbot.cloudfront.net/api/utilities/v1/imageproxy/https://s3.amazonaws.com/coursera-course-photos/5d/689a2063a811e5970465692c5b4361/InnovationBanner-_1_-_2_.jpg,"Creatividad, diseño e innovación: Técnicas y herramientas - Proyecto Final","El estudiante deberá identificar un problema complejo, analizar las oportunidades disponibles y utilizar las herramientas de design thinking, elaboración experiencial de prototipos y una estrategia de innovación para desarrollar soluciones creativas. Dichas soluciones se evaluarán a partir de métricas establecidas para juzgar su idoneidad.El proceso a seguir para ir del problema a la solución es el siguiente:

a. Encontrar una situación que se beneficiaría con soluciones innovadoras.
b. A partir de lo aprendido en los cursos previos, desarrollar un proceso para ir de la búsqueda de problemas dentro del contexto estudiado a la implementación de la solución final.
c. Evaluar las ideas generadas a partir de herramientas y procedimientos específicos.
d. Reflexionar críticamente sobre el proceso.

El proyecto terminal constituye un ejemplo de aprendizaje basado en proyectos en el que el estudiante debe integrar la base de conocimiento y habilidades desarrolladas en los cursos previos de la especialización para resolver un problema específico. Así, pondrá en juego el manejo de diversas herramientas y técnicas que aprendió a lo largo del programa.",3121,16224,4.8,"[{'Estrellas': 5, 'Porcentaje': '86.95'}, {'Estrellas': 4, 'Porcentaje': '10.86'}, {'Estrellas': 3, 'Porcentaje': '2.17'}]",0
https://d3njjcbhbojbot.cloudfront.net/api/utilities/v1/imageproxy/https://s3.amazonaws.com/coursera-course-photos/dc/2b03f5775049faaee16d064ad32381/CuidadoHeridas_FINAL.jpg,Cuidado de heridas en el ámbito hospitalario,"El manejo de heridas ha cambiado radicalmente en los últimos años, a través del desarrollo de evidencia científica. A lo largo de su vida profesional, todo personal de la salud se enfrentará al paciente con heridas, lo cual requiere conocimientos actualizados y efectivos. Por ello, en este curso UNAM encontrarás los conocimientos básicos para el manejo de pacientes con heridas con la finalidad de brindar un cuidado de calidad y seguro.",42487,88747,4.8,"[{'Estrellas': 5, 'Porcentaje': '84.05'}, {'Estrellas': 4, 'Porcentaje': '12.54'}, {'Estrellas': 3, 'Porcentaje': '2.11'}, {'Estrellas': 2, 'Porcentaje': '0.52'}, {'Estrellas': 1, 'Porcentaje': '0.75'}]",96
https://d3njjcbhbojbot.cloudfront.net/api/utilities/v1/imageproxy/https://s3.amazonaws.com/coursera-course-photos/4c/739f568d374f2ea456183eade2348e/Modelo-para-armar_FINAL.jpeg,Cursos en línea: modelo para armar,¿Quieres crear un curso en línea? Estás en el lugar correcto. En alrededor de 20 horas podrás estructurar un curso de acompañamiento completo. Sabrás cómo diseñar sesiones que te permitan interactuar dinámicamente con tus estudiantes y a ellos trabajar en subgrupos en actividades que los mantengan motivados y que promuevan aprendizajes sólidos. ¡Únete a este grupo creciente de maestros y otros interesados en la educación para crear tu curso de acompañamiento en línea!,6231,31609,4.8,"[{'Estrellas': 5, 'Porcentaje': '86.06'}, {'Estrellas': 4, 'Porcentaje': '12.29'}, {'Estrellas': 3, 'Porcentaje': '1.63'}]",98
https://d3njjcbhbojbot.cloudfront.net/api/utilities/v1/imageproxy/https://s3.amazonaws.com/coursera-course-photos/79/598dd9440540d9b01699c240ca5392/Android_4.jpg,Desarrollo de aplicaciones avanzadas con Android,"En este curso se retoman los temas vistos en cursos anteriores. Se complementan con aspectos prácticos como la forma de implementar mapas en tus proyectos con el API de Google Maps. También, muestra cómo aprovechar el multitask de Android y hacer animaciones en 2D  para llevar tus aplicaciones a más dispositivos como weareables, televisiones y autos.Después de este curso, podrás subir tu aplicación a Google Play Store y hacerte visible para el mundo entero.",17967,21706,4.7,"[{'Estrellas': 5, 'Porcentaje': '79.74'}, {'Estrellas': 4, 'Porcentaje': '17.72'}, {'Estrellas': 3, 'Porcentaje': '2.53'}]",93
https://d3njjcbhbojbot.cloudfront.net/api/utilities/v1/imageproxy/https://s3.amazonaws.com/coursera-course-photos/dd/40c00e71874bbb8e1ad7e7b20b6a34/Android_3.jpg,Desarrollo de aplicaciones con Android,"Este curso te permitirá construir tu primer aplicación móvil profesional. Serás capaz de crear y controlar la vida de tus Activities y aprovechar el espacio en pantalla de los diferentes dispositivos Android implementando Fragments en tus aplicaciones. Dale persistencia a tu información utilizando todas las formas de almacenamiento que hay en Android desde un único archivo hasta una Base de Datos.

Podrás evaluar lo aprendido por medio de ejercicios prácticos que te permitirán ir desarrollando tu aplicación.",29071,59348,4.3,"[{'Estrellas': 5, 'Porcentaje': '66.99'}, {'Estrellas': 4, 'Porcentaje': '15.51'}, {'Estrellas': 3, 'Porcentaje': '8.25'}, {'Estrellas': 2, 'Porcentaje': '3.30'}, {'Estrellas': 1, 'Porcentaje': '5.94'}]",92
https://d3njjcbhbojbot.cloudfront.net/api/utilities/v1/imageproxy/https://s3.amazonaws.com/coursera-course-photos/43/f11c66b861477bb3c1ee36bf1e80d0/Database-System_4.jpg,Designing data-intensive applications,"Welcome to the specialization course of Designing data-intensive applications. This course will be completed on four weeks, it will be supported with videos and exercises.

By the end of this specialization, learners will be able to propose, design, justify and develop high reliable information systems according to type of data and volume of information, response time, type of processing and queries in order to support scalability, maintainability, security and reliability considering the last information technologies.

Software to download:
MySQL Workbench 
Rapidminer
Hadoop framework Hortonworks
MongoDB

In case you have a Mac / IOS operating system you need to perform an action called VirtualBox.",4628,12095,0.0,[],0
https://d3njjcbhbojbot.cloudfront.net/api/utilities/v1/imageproxy/https://s3.amazonaws.com/coursera-course-photos/83/333ba931ba4e9483b17febe5996208/Dialisis2_FINAL.jpg,Diálisis peritoneal,"El programa de diálisis peritoneal incluye conocimientos teórico-prácticos de índole resolutivo para la enseñanza del autocuidado en paciente que se dializan en su domicilio.Se estructura a partir de las necesidades de formación que debe cubrir enfermería en las áreas de diálisis peritoneal.

Se consideran como elementos básicos en este curso; conocimiento de la función normal del riñón, Enfermedad Renal Crónica (ERC) en sus diferentes estadios, valoración del paciente para ingreso a
diálisis peritoneal, acceso peritoneal, cuidado del orificio de salida, medidas higiénicas, dietéticas,
manejo de complicaciones en domicilio y los diferentes sistemas de conectología manual.",19578,34041,4.9,"[{'Estrellas': 5, 'Porcentaje': '90.83'}, {'Estrellas': 4, 'Porcentaje': '8.35'}, {'Estrellas': 3, 'Porcentaje': '0.61'}, {'Estrellas': 2, 'Porcentaje': '0.20'}]",96
https://d3njjcbhbojbot.cloudfront.net/api/utilities/v1/imageproxy/https://s3.amazonaws.com/coursera-course-photos/4e/7dd1967ea84e5981f93458b32e5ec3/EstadisticayProb_FINAL.jpg,Estadística y probabilidad,"En este curso podrás apoyar tu formación en temas de estadística y probabilidad I.Más allá de que encuentres aquí un apoyo para lograr una calificación, el curso busca ayudarte a que adquieras los aprendizajes que comprenden temas de estadística descriptiva, datos bivariados y probabilidad, los cuales te serán de utilidad en tu paso por la licenciatura y en tu vida profesional.",47226,207478,4.6,"[{'Estrellas': 5, 'Porcentaje': '72.20'}, {'Estrellas': 4, 'Porcentaje': '20.81'}, {'Estrellas': 3, 'Porcentaje': '4.05'}, {'Estrellas': 2, 'Porcentaje': '1.53'}, {'Estrellas': 1, 'Porcentaje': '1.39'}]",91
https://d3njjcbhbojbot.cloudfront.net/api/utilities/v1/imageproxy/https://s3.amazonaws.com/coursera-course-photos/25/fa4cf2ce6c4066a944fa710e28b767/31.jpg,Estratégicos empresariales: Proyecto final ,"En este curso realizarás un plan de negocio en donde incluirás la filosofía empresarial de tu empresa o idea de negocio; asimismo, identificarás qué factores pueden alterar el curso de tu empresa.Para una mejor toma de decisiones desarrollarás un plan financiero que te permitirá conocer el estatus financiero de tu empresa o idea de negocio.

También implementarás un mix de mercadotecnia para diseñar estrategias que te permitan el punto óptimo de ventas de tu producto y/o servicio y llegar a nichos de mercado imposibles de alcanzar.",0,7660,0.0,[],0
https://d3njjcbhbojbot.cloudfront.net/api/utilities/v1/imageproxy/https://s3.amazonaws.com/coursera-course-photos/c9/9db6dc7e6c4c1e815e34feec4443c1/Finanzas-4.jpg,Estructura de capital y política de dividendos,"En el curso estructura de capital y política de dividendos se analizará la forma en la que una empresa financia sus activos a través de métodos internos o externos, estructurando así su pasivo y capital. Dichas fuentes de financiamiento se ven reflejadas en el costo de capital promedio ponderado (Weighted Average Cost of Capital- WACC). De la mano de la determinación de dicho costo de financiamiento  y de la estructura del capital, el administrador financiero deberá determinar la política de dividendos, tomando como referencia el teorema de Modilgliani – Miller. En este curso el administrador financiero adicionalmente será capaz de evaluar activos financieros o portafolios, evaluando la relacion que existe entre riesgo y retorno bien a través del modelo Capital Asset Pricing Model  CAPM o del Arbitrage Pricing Theory APT.",4992,19392,3.6,"[{'Estrellas': 5, 'Porcentaje': '38.30'}, {'Estrellas': 4, 'Porcentaje': '16.53'}, {'Estrellas': 3, 'Porcentaje': '21.37'}, {'Estrellas': 2, 'Porcentaje': '11.69'}, {'Estrellas': 1, 'Porcentaje': '12.09'}]",86
https://d3njjcbhbojbot.cloudfront.net/api/utilities/v1/imageproxy/https://s3.amazonaws.com/coursera-course-photos/94/0cf46185cb4c85813d1cf31dd843bb/Finanzas-3.jpg,Evaluación de inversiones en Bienes de Capital ,"En el curso presupuesto de largo plazo o de bienes de capital el administrador financiero aplicarás los elementos del valor del dinero a través del tiempo, para poder proyectar los estados financieros a una fecha futura, considerando las variables económicas que pueden afectar un proyecto de inversión. De igual forma serás capaz de calcular el valor presente neto, la tasa interna de rendimiento como elementos primordiales para la evaluación de los proyectos de inversión en bienes de capital de una empresa.",7935,21991,4.2,"[{'Estrellas': 5, 'Porcentaje': '56.04'}, {'Estrellas': 4, 'Porcentaje': '24.18'}, {'Estrellas': 3, 'Porcentaje': '10.61'}, {'Estrellas': 2, 'Porcentaje': '5.01'}, {'Estrellas': 1, 'Porcentaje': '4.12'}]",89
https://d3njjcbhbojbot.cloudfront.net/api/utilities/v1/imageproxy/https://s3.amazonaws.com/coursera-course-photos/06/42c763011c404d967a7e44ce6fd0d9/EvalPeligroR2_FINAL.jpg,Evaluación de peligros y riesgos por fenómenos naturales,"Reconocer el conocimiento básico sobre los factores físicos y sociales que condicionan el riesgo de una sociedad por fenómenos extremos de origen natural (sismos, huracanes, etc.) y promover las acciones necesarias para reducir el impacto de los desastres en una comunidad.",16035,27566,4.8,"[{'Estrellas': 5, 'Porcentaje': '85.40'}, {'Estrellas': 4, 'Porcentaje': '11.80'}, {'Estrellas': 3, 'Porcentaje': '1.71'}, {'Estrellas': 2, 'Porcentaje': '0.85'}, {'Estrellas': 1, 'Porcentaje': '0.21'}]",96
https://d3njjcbhbojbot.cloudfront.net/api/utilities/v1/imageproxy/https://s3.amazonaws.com/coursera-course-photos/bc/d5b812bb8840a5b090b7ccdde48f82/EvaluacionEdu_1.jpg,Evaluación educativa del y para el aprendizaje en educación superior,"La visión contemporánea del aprendizaje como un proceso activo, constructivo y flexible, además de la diversidad de experiencias de aprendizaje y contextos donde estas se desarrollan, exige al profesorado el diseño de instrumentos de prácticas de evaluación que correspondan a estas necesidades.Identificar los conocimientos que adquieren los alumnos y considerar las estrategias más adecuadas para evaluarlos, ayudará a que los profesores implementen mejores prácticas de evaluación, sustentadas en un enfoque formativo, en el que los estudiantes reciban realimentación frecuente sobre su aprendizaje, y a partir de ello puedan construir activamente su conocimiento y juzgar críticamente su formación.
A través de las experiencias de aprendizaje se pretende que los participantes realicen un ejercicio de reflexión crítica de conceptos tales como: evaluación del y para el aprendizaje, evaluación formativa, evaluación diagnóstica, evaluación sumativa, criterios para una buena evaluación, exámenes de alto impacto y sus implicaciones educativas, aspectos legales, éticos y sociales de la evaluación.",14810,25508,4.8,"[{'Estrellas': 5, 'Porcentaje': '85.49'}, {'Estrellas': 4, 'Porcentaje': '12.97'}, {'Estrellas': 3, 'Porcentaje': '0.76'}, {'Estrellas': 2, 'Porcentaje': '0.25'}, {'Estrellas': 1, 'Porcentaje': '0.50'}]",98
https://d3njjcbhbojbot.cloudfront.net/api/utilities/v1/imageproxy/https://s3.amazonaws.com/coursera-course-photos/56/3c320f762b4864a4c8d9048d1de8e0/EvaluacionEdu_3.jpg,Evaluación para el aprendizaje: Enfoque cualitativo,"La formación en educación media superior y superior implica no solamente el aprendizaje de conocimientos, sino también el desarrollo de habilidades y la formación de actitudes y valores, para lo cual es fundamental contar con instrumentos, estrategias y técnicas que le permitan al profesor obtener información sobre el progreso de sus estudiantes y así contribuir a la toma de decisiones para alcanzar el logro de los aprendizajes esperados, para ello el uso sistemático de instrumentos de evaluación de carácter cualitativo es frecuente en educación superior, particularmente en las áreas sociales y de la salud, como por ejemplo en Biología, Trabajo social, Psicología, Medicina, Antropología, entre otras.Por esto es necesario que los docentes conozcan algunos de los instrumentos más empleados dentro de la evaluación cualitativa que pueden ayudar a la formación y a la evaluación de sus estudiantes, al mismo tiempo que obtienen evidencias respecto al avance y los logros de cada uno de ellos. 

Este curso pretende que a través de ciertos recursos didácticos (videos, actividades, ejercicios y preguntas para reflexionar) el docente explore las posibilidades que ofrecen los instrumentos para realizar evaluaciones de carácter cualitativo.",2390,11984,4.9,"[{'Estrellas': 5, 'Porcentaje': '90'}, {'Estrellas': 4, 'Porcentaje': '8.33'}, {'Estrellas': 3, 'Porcentaje': '1.66'}]",0
