Logo (ruta),Título,Descripción,Inscripciones,Vistas,Rating general,Rating por estrellas,Rating del contenido
https://d3njjcbhbojbot.cloudfront.net/api/utilities/v1/imageproxy/https://s3.amazonaws.com/coursera-course-photos/90/95199cd827425e9a6a9668f06b6679/EvaluacionEdu_2.jpg,Evaluación para el aprendizaje: Enfoque cuantitativo,"La perspectiva contemporánea de la educación ha considerado que dentro del proceso educativo es indispensable la evaluación como una parte esencial de la enseñanza  y el aprendizaje. Realizar este proceso de manera adecuada requiere de una formación especializada que nos permita conocer tanto el proceso en sí mismo, así como los elementos involucrados en él y la pertinencia de hacer uso de las técnicas e instrumentos más adecuados y necesarios para cada tipo de evaluación. El conocimiento de los instrumentos de evaluación es una parte fundamental de la formación para la evaluación para el aprendizaje, para fines didácticos existen dos manera de clasificar a estos instrumentos: cuantitativos y cualitativos. 

A través de una serie de videos, actividades y ejercicios, se pretende que en este curso conozcas el concepto, las características, el diseño, la elaboración y el uso de resultados de cuatros de los instrumentos más utilizados en el enfoque cuantitativo de la evaluación para el aprendizaje: las pruebas objetivas, la lista de cotejo, el quiz y la rúbrica. 

Al término del curso: 
El participante diseñará los instrumentos de evaluación para el aprendizaje que integran el enfoque cuantitativo para sustentar evaluaciones pertinentes, altamente formativas y éticas.",2797,22295,4.8,"[{'Estrellas': 5, 'Porcentaje': '80.82'}, {'Estrellas': 4, 'Porcentaje': '16.43'}, {'Estrellas': 3, 'Porcentaje': '1.36'}, {'Estrellas': 2, 'Porcentaje': '1.36'}]",0
https://d3njjcbhbojbot.cloudfront.net/api/utilities/v1/imageproxy/https://s3.amazonaws.com/coursera-course-photos/56/2186047a2f4ad79453c4c12cf01d9c/FarmacoOdonto_FINAL.jpg,Farmacología para odontólogos,"La farmacología es fundamental en la atención de un paciente en odontología, ya que el control del dolor, las patologías causadas por microorganismos y las de carácter sistémico son del quehacer diario del odontólogo.En este curso, aprenderás sobre los medicamentos más usados en odontología, así como sus indicaciones, contraindicaciones e interacciones medicamentosas.",28348,38798,4.8,"[{'Estrellas': 5, 'Porcentaje': '82.16'}, {'Estrellas': 4, 'Porcentaje': '13.15'}, {'Estrellas': 3, 'Porcentaje': '3.07'}, {'Estrellas': 2, 'Porcentaje': '1.16'}, {'Estrellas': 1, 'Porcentaje': '0.43'}]",97
https://d3njjcbhbojbot.cloudfront.net/api/utilities/v1/imageproxy/https://s3.amazonaws.com/coursera-course-photos/52/b3a220506241d7a38fa8624222af08/FarmacovigilancaOcular_FINAL.jpg,Farmacovigilancia ocular,"En este curso, el participante identificará entre una reacción adversa al medicamento, un evento temporalmente asociado a vacunas y las consecuencias adversas de las tecnologías médicas. Se busca la mejora de la seguridad del paciente al disminuir el riesgo de pérdida de la visión o afecciones oculares secundarias a través de la valoración del caso y la aplicación de técnicas diagnósticas oculares. La farmacovigilancia ocular es una actividad que puede realizar cualquier profesional de la salud, en el entendido de que busca la efectividad del fármaco y el seguimiento de problemas comunes poco identificados en la población, los cuales dependen de las potenciales interacciones medicamentosas (fármaco-fármaco, fármaco-alimento, fármaco-planta medicinal). Al término del curso:

•	Promoverás la actividad de identificación y notificación de reacciones adversas a medicamentos (RAM), eventos temporalmente asociados a vacunas (ESAVI), y consecuencias del uso de dispositivos médicos (tecnovigilancia).",7034,14259,4.8,"[{'Estrellas': 5, 'Porcentaje': '84.23'}, {'Estrellas': 4, 'Porcentaje': '13.58'}, {'Estrellas': 3, 'Porcentaje': '1.63'}, {'Estrellas': 2, 'Porcentaje': '0.54'}]",0
https://d3njjcbhbojbot.cloudfront.net/api/utilities/v1/imageproxy/https://s3.amazonaws.com/coursera-course-photos/d3/bc870cf2164d5facb8114be96f9fb6/FinanzasPersonales_FINAL.jpg,Finanzas personales,"Este curso, ofrecido por la UNAM, dotará a sus participantes con las herramientas que le permitirán llevar a cabo una planeación financiera personal y entender la necesidad de salvaguardar su patrimonio y recursos financieros, así como los requerimientos mínimos que se deben considerar para tomar buenas decisiones financieras.",373471,213465,4.8,"[{'Estrellas': 5, 'Porcentaje': '80.92'}, {'Estrellas': 4, 'Porcentaje': '16.13'}, {'Estrellas': 3, 'Porcentaje': '2.05'}, {'Estrellas': 2, 'Porcentaje': '0.54'}, {'Estrellas': 1, 'Porcentaje': '0.33'}]",99
https://d3njjcbhbojbot.cloudfront.net/api/utilities/v1/imageproxy/https://s3.amazonaws.com/coursera-course-photos/05/b2039234f1461e81a17266d6ba8955/FuncionesAlgebraicas_FINAL.jpg,Funciones algebraicas y trascendentes ,"En este curso estudiarás las funciones algebraicas y trascendentes desde su definición y notación.Resolverás problemas de la vida cotidiana que se modelan a través de funciones:
Polinomiales
Racionales
Con Radicales
Exponenciales
Logarítmicas
Trigonométricas
Para las cuales utilizarás conceptos y procedimientos de aritmética, álgebra y trigonometría, así como de la geometría euclidiana y de la analítica.
Utilizarás un Software dinámico (libre) que te apoyará en la exploración de la representación gráfica de la función para comprender las relaciones entre los parámetros de la representación algebraica.
Realizarás generalizaciones para obtener la regla de correspondencia de la función.
Deducirás e inferirás gracias a este estudio apoyado siempre en las tres representaciones:
Tablas numéricas
Gráfica
Expresión algebraica",3293,13082,4.7,"[{'Estrellas': 5, 'Porcentaje': '81.63'}, {'Estrellas': 4, 'Porcentaje': '10.20'}, {'Estrellas': 3, 'Porcentaje': '6.12'}, {'Estrellas': 2, 'Porcentaje': '2.04'}]",0
https://d3njjcbhbojbot.cloudfront.net/api/utilities/v1/imageproxy/https://s3.amazonaws.com/coursera-course-photos/c1/06c59464ea43ed861ba6de02c05821/FundamentosAgro_FINAL.jpg,Fundamentos de agrotecnología,"Las nuevas tendencias en la industria agroalimentaria, el cambio climático y las necesidades globales de alimentación hacen que la forma de cultivar, hacer llegar los alimentos a la industria y de allí a las mesas de los consumidores cambien. La tecnología aporta nuevas herramientas que, empleadas de forma adecuada y precisa, potencian y coadyuvan los diferentes procesos de la producción agrícola Al usar nuevas tecnologías se aprovechan las economías de escala permitiendo el acceso para grandes como y pequeños productores lo que deriva una mayor cantidad y calidad de alimentos para contribuir con la seguridad alimentaria de todos en el futuro próximo.",6498,15394,4.8,"[{'Estrellas': 5, 'Porcentaje': '79.64'}, {'Estrellas': 4, 'Porcentaje': '17.69'}, {'Estrellas': 3, 'Porcentaje': '1.76'}, {'Estrellas': 2, 'Porcentaje': '0.88'}]",97
https://d3njjcbhbojbot.cloudfront.net/api/utilities/v1/imageproxy/https://s3.amazonaws.com/coursera-course-photos/91/57b4d982c644d384ad844eb1e3f440/Android_2.jpg,Fundamentos de Android,"Por medio de ejercicios prácticos, serás capaz de manipular las herramientas que Android te ofrece para desarrollar aplicaciones móviles. En este curso ofrecido por la UNAM, instalarás el entorno de desarrollo Android Studio y manipularás sus más sofisticadas particularidades. Por ejemplo, la composición de archivos de un proyecto Android y los patrones más comunes para el desarrollo de tus aplicaciones.

Identificarás todas las opciones que tienes para emular con los Android Virtual Devices, su funcionamiento y configuración.

También, reconocerás, las herramientas exclusivas que Android Studio tiene para tus aplicaciones móviles.  Usando Material Design para Android harás que tus aplicaciones luzcan como siempre las quisiste. 

Además, conocerás las mejores prácticas de maquetado para tus aplicaciones, no codifiques si no tienes mockup.",36037,45630,4.5,"[{'Estrellas': 5, 'Porcentaje': '69.40'}, {'Estrellas': 4, 'Porcentaje': '19.96'}, {'Estrellas': 3, 'Porcentaje': '5.63'}, {'Estrellas': 2, 'Porcentaje': '2.73'}, {'Estrellas': 1, 'Porcentaje': '2.25'}]",95
https://d3njjcbhbojbot.cloudfront.net/api/utilities/v1/imageproxy/https://s3.amazonaws.com/coursera-course-photos/53/9532c4bb2746c39f6ac50160c2c65f/Habilidades-gerenciales_2.jpg,Gestión del talento humano,"El curso aborda la organización desde una perspectiva sistémica en donde todos los elementos interactúan para lograr un resultado productivo. Se enfatiza la importancia de habilidades gerenciales para lograr estos propósitos. Realizarás ejercicios para potencializar tus niveles de inteligencia emocional y comunicación asertiva implicando a tus colaboradores en el desarrollo de estas habilidades. Ésto, con el fin de generar climas laborales en donde la confianza, motivación y respeto sean actitudes cotidianas.",22365,68789,4.8,"[{'Estrellas': 5, 'Porcentaje': '85.84'}, {'Estrellas': 4, 'Porcentaje': '11.95'}, {'Estrellas': 3, 'Porcentaje': '1.93'}, {'Estrellas': 2, 'Porcentaje': '0.19'}, {'Estrellas': 1, 'Porcentaje': '0.06'}]",99
https://d3njjcbhbojbot.cloudfront.net/api/utilities/v1/imageproxy/https://s3.amazonaws.com/coursera-course-photos/d5/c102bf7ed7480f90cb761bcf12cb86/GestionRiesgos_FINAL.jpg,Gestión integral del riesgo de desastres,"El curso está orientado a las personas que ya cuentan con nociones de planificación y que tienen conocimientos generales sobre las principales amenazas en un contexto particular desde una disciplina específica. Presenta los conceptos más importantes, así como ejemplos y problemas para el análisis de temas de gestión integral del riesgo de desastres que, regularmente, deben abordarse desde ámbitos nacionales o federales, municipales o locales. Cada persona podrá profundizar en temas de su interés con base en la bibliografía que se ofrece como recurso adicional.*Éste no es un curso que enseñe la manera de responder a una emergencia. Otros ya abordan esa tarea importante. Nuestro objetivo es que cada participante se aproxime a las nociones más generales de la gestión integral de riesgos, mismas que pueden ser de utilidad en instituciones públicas tanto cuanto en organizaciones privadas.",5662,24334,4.8,"[{'Estrellas': 5, 'Porcentaje': '83.89'}, {'Estrellas': 4, 'Porcentaje': '12.08'}, {'Estrellas': 3, 'Porcentaje': '4.02'}]",0
https://d3njjcbhbojbot.cloudfront.net/api/utilities/v1/imageproxy/https://s3.amazonaws.com/coursera-course-photos/0d/3dcc31a81e4395866d94a53ca81367/TecMusical_2.jpg,Grabación y postproducción musical dentro y fuera del estudio,"En este curso aprenderás a elaborar una producción musical con Ardour.  Vamos a trabajar la preproducción, grabación y postproducción de un proyecto musical.  Al término, podrás discernir cuándo es que tu arreglo musical está listo para grabación, cómo escoger los micrófonos y posicionamientos adecuados para los mismos, así como el trabajo después de la grabación.  Finalizamos el curso con una grabación masterizada, lista para distribución.",2502,11306,4.7,"[{'Estrellas': 5, 'Porcentaje': '83.58'}, {'Estrellas': 4, 'Porcentaje': '11.94'}, {'Estrellas': 3, 'Porcentaje': '1.49'}, {'Estrellas': 2, 'Porcentaje': '1.49'}, {'Estrellas': 1, 'Porcentaje': '1.49'}]",0
https://d3njjcbhbojbot.cloudfront.net/api/utilities/v1/imageproxy/https://s3.amazonaws.com/coursera-course-photos/00/8f6f5821164297855b8db06027e55d/Habilidades-gerenciales_6.jpg,Habilidades gerenciales: Proyecto final,"En este curso, desarrollarás un plan estratégico que te permitirá identificar, desarrollar y alinear la misión, visión, valores y objetivos estratégicos de tu función directiva con los de la empresa en la que laboras. Del mismo modo diseñarás las estrategias e indicadores para lograrlo de manera realista y eficiente.",5055,21671,4.8,"[{'Estrellas': 5, 'Porcentaje': '88.26'}, {'Estrellas': 4, 'Porcentaje': '9.18'}, {'Estrellas': 3, 'Porcentaje': '1.53'}, {'Estrellas': 2, 'Porcentaje': '1.02'}]",0
https://d3njjcbhbojbot.cloudfront.net/api/utilities/v1/imageproxy/https://s3.amazonaws.com/coursera-course-photos/d5/b7487526714c6f8752800d83041f21/EstrategiasNegociacion_2.jpg,Habilidades humanas y de negocios para negociar,"En este curso los participantes analizarán los conceptos de efectividad de una negociación, que consiste en una interacción humana, y la satisfacción de los deseos e intereses en las negociaciones.Todos tenemos el deseo de mejorar y superarnos. La forma de lograrlo es conocerse a sí mismo y a las personas con las que se negocia o se interactúa.",24156,36440,4.8,"[{'Estrellas': 5, 'Porcentaje': '84.75'}, {'Estrellas': 4, 'Porcentaje': '11.52'}, {'Estrellas': 3, 'Porcentaje': '1.85'}, {'Estrellas': 2, 'Porcentaje': '1.48'}, {'Estrellas': 1, 'Porcentaje': '0.37'}]",99
https://d3njjcbhbojbot.cloudfront.net/api/utilities/v1/imageproxy/https://s3.amazonaws.com/coursera-course-photos/73/a1805c3a0245cc9039b726b18b74b5/InnovAgroaliment_FINAL.jpg,Innovación agroalimentaria ,"Este curso fue desarrollado por el Instituto Interamericano de Cooperación para la Agricultura (IICA) en colaboración con la Universidad Nacional Autónoma de México (UNAM)  con el propósito de introducir el tema de Innovación y su importancia en el sector Agroalimentario. En un mundo donde la globalización de los mercados es imperante y el cambio climático afecta las prácticas agrícolas, la competitividad sin innovación no es procedente. Por ello, durante el curso se analiza y reconoce la innovación como un agente que promueve la competitividad.  

Para lograrlo, este curso revisa los fundamentos de la innovación, también, abarca otros temas como propiedad intelectual, componentes para la gestión de la innovación, sistemas nacionales de  innovación agroalimentaria y nuevos hábitos alimenticios que abren paso a la innovación de nuevos productos. Este curso es una oportunidad para que los pequeños y medianos empresarios, vinculados al sector agroalimentario, o ajenos a este sector, cuenten con herramientas que les faciliten el desarrollo de nuevos productos de calidad que incrementen su competitividad en el mercado.

Te invitamos a unirte a este curso y continuar por el camino de la innovación.",24312,16623,4.7,"[{'Estrellas': 5, 'Porcentaje': '73.48'}, {'Estrellas': 4, 'Porcentaje': '22.37'}, {'Estrellas': 3, 'Porcentaje': '3.59'}, {'Estrellas': 2, 'Porcentaje': '0.55'}]",99
https://d3njjcbhbojbot.cloudfront.net/api/utilities/v1/imageproxy/https://s3.amazonaws.com/coursera-course-photos/94/f9e087fa7f4ccfb35c6c1363761522/ProgramacionConR_FINAL.jpg,Introducción a Data Science: Programación Estadística con R,"Este curso te proporcionará las bases del lenguaje de programación estadística R, la lengua franca de la estadística, el cual te permitirá escribir programas que lean, manipulen y analicen datos cuantitativos. Te explicaremos la instalación del lenguaje; también verás una introducción a los sistemas base de gráficos y al paquete para graficar ggplot2, para visualizar estos datos. Además también abordarás la utilización de uno de los IDEs más populares entre la comunidad de usuarios de R, llamado RStudio.Objetivo

Al término del curso:

Utilizarás el lenguaje de programación R con el fin de manipular datos, generar análisis estadísticos y representación gráfica, a través del procesamiento de datos cuantitativos.

Forma de trabajo

Este curso busca introducirte en el lenguaje de programación estadística R, un lenguaje computacional diseñado para el análisis estadístico de datos. Este curso está dirigido a estudiantes y profesionales que tienen interés en poder utilizar esta herramienta, para leer, manipular, analizar y graficar datos. 

Utilizarás un IDE (Ambiente de Desarrollo Integrado) muy popular para trabajar con el lenguaje R, llamado RStudio, que se ha vuelto el IDE de facto para programar en R.

En cada módulo encontrarás videos que te guiarán en la instalación de las herramientas a utilizar, así como explicaciones de las operaciones básicas y los elementos específicos que ofrecen un manejo más profundo del lenguaje. También hallarás algunas referencias bibliográficas para ahondar en el tema que sea de tu interés.

Para complementar las lecciones, realizarás prácticas con el lenguaje, las cuales tendrán valor para la evaluación.",164805,123198,4.7,"[{'Estrellas': 5, 'Porcentaje': '77.38'}, {'Estrellas': 4, 'Porcentaje': '19.44'}, {'Estrellas': 3, 'Porcentaje': '2.45'}, {'Estrellas': 2, 'Porcentaje': '0.39'}, {'Estrellas': 1, 'Porcentaje': '0.31'}]",97
https://d3njjcbhbojbot.cloudfront.net/api/utilities/v1/imageproxy/https://s3.amazonaws.com/coursera-course-photos/55/7b3941150f4632b9818e71d2ff7c27/fba781ae2.jpg,Introducción a Java,"Me llamo Elisa Viso y una de mis pasiones es la de programar y enseñar a programar. El lenguaje Java es uno de los que más me ha gustado en mis 45 años que llevo programando. Si bien te podrá parecer un poco complicado empezar a programar en Java, una vez que cubras los conceptos básicos verás qué rápido se avanza.
Java, como todos los lenguajes de programación bien hechos, te dejan hacer cualquier cosa (algunas de ellas con más trabajo que en otros lenguajes y otras casi directamente de cómo piensas la solución al problema). 
Pero una vez que pasas esa primera etapa, programar te va a hacer sentir casi como un sacerdote de un culto extraño, que puede hacer que las cosas sucedan a placer, se vean exactamente como tú quieres y obtengas una satisfacción enorme de haber construido algo que puedes ver y repartirlo para que otros lo usen.

Este es un curso introductorio a la programación en Java. Como Java es un lenguaje orientado a objetos de propósito general, revisaremos los conceptos básicos del lenguaje como clases e interfaces. Veremos los ingredientes básicos de una clase como constantes y variables, funciones (métodos), y cómo organizar estos ingredientes dentro de una clase. También veremos la utilización de clases de las bibliotecas de Java.

En el primer módulo revisaremos el concepto de orientación a objetos aplicándolo en la vida real.

En el segundo módulo revisamos una herramienta de diseño orientado a objetos, llamada tarjetas de responsabilidades, y a partir de estas últimas diseñamos los encabezados de los distintos servicios que se van a dar, codificándolos en una interfaz.

En el tercer módulo terminaremos la construcción de la clase que corresponde a este problema, aclarando términos comunes en Java, revisando la sintaxis del lenguaje y la autodocumentación con la que cuenta.

En el cuarto módulo utilizaremos lo que ya tenemos para construir una clase más compleja que proporciones arreglos de objetos de la clase que ya tenemos y examinando con bastante profundidad tanto el esquema conceptual de los arreglos como su implementación en el modelo de memoria de Java.

En el quinto y último módulo profundizaremos en el uso de repetición en ejecución y, no puede faltar, los distintos tipos de ejecución condicional que provee el lenguaje.

En este curso, ofrecido por la UNAM, se proveerá al participante con conocimientos del lenguaje Java que le permitirán resolver una amplia gama de problemas con este lenguaje. Aprenderá a:
•	Plantear la solución de un problema utilizando orientación a objetos.
•	Programar la solución de los problemas utilizando las siguientes características del lenguaje Java:
               -Interfaces y clases
               -Métodos constructores de objetos, de acceso, de actualización, de implementación y auxiliares.
               -Atributos y variables locales de tipos primitivos o de clase.
               -Utilización de clases de biblioteca.
               -Esquemas de ejecución como la repetición y la selección de enunciados
               -Arreglos",110192,149592,4.2,"[{'Estrellas': 5, 'Porcentaje': '59.81'}, {'Estrellas': 4, 'Porcentaje': '20.99'}, {'Estrellas': 3, 'Porcentaje': '8.30'}, {'Estrellas': 2, 'Porcentaje': '3.92'}, {'Estrellas': 1, 'Porcentaje': '6.94'}]",95
https://d3njjcbhbojbot.cloudfront.net/api/utilities/v1/imageproxy/https://s3.amazonaws.com/coursera-course-photos/64/b01fa0c66b40d4b815a151541c4653/30.jpg,Introducción a la calidad,"Al finalizar el curso: •	Explicarás la aplicación de la norma ISO 9000 y los sistemas de gestión de calidad, su implementación y los beneficios para la compañía y la sociedad.
•	Describirás herramientas prácticas que mejoren la competitividad y eleven la eficiencia de las operaciones de la empresa o idea de negocio teniendo en cuenta las mejores prácticas ambientales.

En este curso conoceremos la importancia que tiene implementar estándares de calidad y procesos productivos eficientes, para el desarrollo y continuidad de nuestra empresa o idea de negocio y así mantener su máxima capacidad productiva y seguir ofertando productos con los más altos estándares de calidad, para mantenernos siempre en la preferencia del público.

Es importante resaltar también términos como capacidad, ubicación y distribución operativa con la que cuenta nuestra empresa o idea de negocio, porque al identificarlas podemos mejorar la productividad sin hacer a un lado la calidad, a la vez que identificamos las deficiencias la producción para nuestra empresa o idea de negocio.",18291,49016,4.7,"[{'Estrellas': 5, 'Porcentaje': '75.77'}, {'Estrellas': 4, 'Porcentaje': '16.95'}, {'Estrellas': 3, 'Porcentaje': '5.19'}, {'Estrellas': 2, 'Porcentaje': '0.69'}, {'Estrellas': 1, 'Porcentaje': '1.38'}]",97
https://d3njjcbhbojbot.cloudfront.net/api/utilities/v1/imageproxy/https://s3.amazonaws.com/coursera-course-photos/5f/eb406381ae49b793418ebeeb9bda82/27.jpg,Introducción a la estrategia,"En este curso, conocerás la importancia de la estrategia en cualquier tipo de organización; diferenciarás los modelos conductuales que se aplican en diferentes países, quiénes son sus principales actores y los intereses que tienen en una empresa. Partirás de la planeación estratégica para materializar tu idea de negocio, a través de la misión, visión, valores y objetivos. Identificarás la idea diferenciadora de tu empresa o idea de negocio, lo cual la hará única del resto. Leerás las señales internas y externas del entorno para poder reaccionar a tiempo ante los factores que afectan a tu empresa.",22827,45278,4.8,"[{'Estrellas': 5, 'Porcentaje': '84.50'}, {'Estrellas': 4, 'Porcentaje': '12.67'}, {'Estrellas': 3, 'Porcentaje': '2.25'}, {'Estrellas': 2, 'Porcentaje': '0.28'}, {'Estrellas': 1, 'Porcentaje': '0.28'}]",98
https://d3njjcbhbojbot.cloudfront.net/api/utilities/v1/imageproxy/https://s3.amazonaws.com/coursera-course-photos/19/fccc63203e47b19df21b601fc0b348/geotermia.jpeg,Introducción a la geotermia,"Este curso está enfocado en introducir a las técnicas de exploración en Geotermia a profesionistas (de todas las Ingenierías y Licenciaturas en Geociencias, Ambientalistas, Economistas y carreras afines) interesados en las energías limpias. Les proporcionará información científica y técnica sobre las bases y nuevas corrientes para fomentar el interés en la energía geotérmica.El curso incluye temas de frontera en Geología, Geoquímica, Geofísica aplicados a la Exploración de recursos geotérmicos, conceptos básicos de la geotermia y su utilización.",16923,21062,4.8,"[{'Estrellas': 5, 'Porcentaje': '86.85'}, {'Estrellas': 4, 'Porcentaje': '11.95'}, {'Estrellas': 3, 'Porcentaje': '0.79'}, {'Estrellas': 2, 'Porcentaje': '0.19'}, {'Estrellas': 1, 'Porcentaje': '0.19'}]",98
https://d3njjcbhbojbot.cloudfront.net/api/utilities/v1/imageproxy/https://s3.amazonaws.com/coursera-course-photos/84/2f1bd6623b44fc9341fd155817b2a8/ProdAudiovisual_FINAL.jpg,Introducción a la producción audiovisual,"En este curso revisaremos el lenguaje y herramientas básicas, así como las diferentes etapas del proceso de producción, para crear un proyecto audiovisual.",58910,73134,4.7,"[{'Estrellas': 5, 'Porcentaje': '79.89'}, {'Estrellas': 4, 'Porcentaje': '14.97'}, {'Estrellas': 3, 'Porcentaje': '3.37'}, {'Estrellas': 2, 'Porcentaje': '0.94'}, {'Estrellas': 1, 'Porcentaje': '0.80'}]",98
https://d3njjcbhbojbot.cloudfront.net/api/utilities/v1/imageproxy/https://s3.amazonaws.com/coursera-course-photos/a4/14e93a2abe4dc18f91dcca7f759767/TecMusical_1.jpg,Introducción a la producción musical ,"En este curso aprenderás los elementos básicos para realizar tu primer producción musical con herramientas tecnológicas disponibles en la red y basadas en software libre. Cada módulo aborda de forma teórica y práctica temas clave de la producción musical, los cuales servirán para la elaboración de un proyecto propio de producción musical.",5427,16642,4.9,"[{'Estrellas': 5, 'Porcentaje': '87.78'}, {'Estrellas': 4, 'Porcentaje': '10.68'}, {'Estrellas': 3, 'Porcentaje': '1.52'}]",96
